{
  "$schema": "http://json-schema.org/draft-04/schema#",
  "type": "object",
  "properties": {
    "title": {
      "type": "string",
      "minLength": 1
    },
    "homeUrl": {
      "type": "string",
      "minLength": 1
    },
    "text": {
      "type": "string",
      "minLength": 1
    },
    "menu": {
      "$ref": "menu.schema.json"
    }
  },
  "required": [
    "title",
    "homeUrl",
    "text"
  ]
}
