{
  "title": "Some company",
  "homeUrl": "#",
  "text": "Synergizing your virtual interfaces to disintermediate open-source e-commerce",
  "menu": {
    "items": [
      {
        "text": "page 1",
        "url": "#",
        "isCurrent": true
      },
      {
        "text": "page 2",
        "url": "#"
      }
    ]
  }
}
